utterance,labels
เตือนฉันในอีกสองสัปดาห์เพื่อพาลูกสาวไปฝึก,set_reminder
เตือนความจำของฉันสำหรับเช้านี้คืออะไร?,show_reminders
เตือนฉันให้พิมพ์งานของฉันตอน4โมงเย็น,set_reminder
เตือนฉันให้ซื้อขนมปัง,set_reminder
เตือนฉันให้ซื้อไข่ที่ร้านขายของชำคืนนี้,set_reminder
เตือนฉันให้จ่ายค่าเล่าเรียน,set_reminder
เตือนฉันให้ซื้ออาหารสุนัข,set_reminder
เตือนฉันซื้อนม,set_reminder
คุณมีเตือนความจำให้ฉันไหมในวันนี้,show_reminders
เตือนฉันให้ทิ้งตารางเวลา,set_reminder
ยกเลิกเตือนความจำทั้งหมดของฉัน,cancel_reminder
เตือนฉันให้นำถังขยะออกพรุ่งนี้ที่ตอน8โมง,set_reminder
ยกเลิกเตือนความจำทั้งหมด,cancel_reminder
เตือนฉันให้ไปที่ร้านค้าในวันพรุ่งนี้,set_reminder
เตือนฉันให้โทรหา Dan,set_reminder
ตั้งค่าเตือนความจำแพทย์สายตาเป็นวันที่ 25,set_reminder
เตือนฉันให้โทรหาแม่คืนนี้,set_reminder
แสดงเตือนความจำทั้งหมด,show_reminders
ยกเลิกเตือนความจำทั้งหมด,cancel_reminder
มีรายการอะไรบ้างในเตือนความจำ,show_reminders
เตือนฉันให้ไปที่ร้านขายกระดานโต้คลื่นในวันนี้,set_reminder
ยกเลิกเตือนความจำเรื่องค่าไฟฟ้า,cancel_reminder
ดูเตือนความจำทั้งหมด,show_reminders
เตือนฉันให้พาสุนัขไปหาสัตว์แพทย์ต่อไปในเช้าวันพุธ,set_reminder
เตื่อนฉันเกี่ยวกับงานปาตี้ในสุดสัปดาห์นี้,set_reminder
แสดงเตือนความจำของฉันในวันนี้,show_reminders
เตือนฉันให้พาสุนัขไปเดินเวลา 6:30 น.,set_reminder
เตือนความจำของฉันคืออะไร?,show_reminders
ลบเตือนความจำทั้งหมด,cancel_reminder
เตือนฉันว่าให้ทำกายภาพในวันจันทร์เวลา 7.00 น.,set_reminder
ยกเลิกเตือนความจำเพื่อไปที่เดอะมอลล์ในวันเสาร์นี้,cancel_reminder
แสดงเตือนความจำของฉัน,show_reminders
เตือนฉันให้ใช้การควบคุมการเกิดของฉันเวลา 19.00 น.,set_reminder
ฉันต้องการเตือนความจำให้รับ Lisa,set_reminder
เตือนให้ฉันไปหาดรในวันพรุ่งนี้เวลา 3 โมงเย็น,set_reminder
เตือนฉันให้ส่งดอกไม้สำหรับวันเกิดของแม่,set_reminder
เตือนฉันให้ตั้งปลุก,set_reminder
เตือนฉันให้ซื้อผ้าอ้อมเด็ก,set_reminder
เตือนฉันถึงนัดหมายเวลา 15.00 น,set_reminder
คุณช่วยจดรายเตือนความจำความจำของฉันได้ไหม?,show_reminders
ตั้งค่าเตือนความจำให้โทรหาแม่ที่พรุ่งนี้,set_reminder
มีพายุโซนร้อนอยู่บริเวณชายฝั่งหรือไม่?,find
ฝนตกในสัปดาห์นี้หรือไม่,find
ฝนตกในซีแอตเติลไหม?,find
วันนี้ฝนจะตกไหม,find
ช่วงบ่ายนี้จะร้อนแค่ไหน?,find
วันนี้จะมีแดดไหม?,find
วันนี้มีแดดไหม,find
เวลาพายุกำลังจะเริ่ม?,find
ควรจะมีฝนตกทั้งวันหรือไม่?,find
ในพยากรณ์อากาศมีฝนตกสำหรับสัปดาห์หน้าหรือไม่?,find
ตอนเย็นในซานดิเอโกจะหนาวหรือไม่?,find
คาดว่าจะมีพายุคืนนี้หรือไม่?,find
สภาพอากาศใน Elkton วันนี้เวลา 5 โมงเย็นคืออะไร?,find
ฉันต้องการเสื้อกันฝนไหม,find
ในพยากรณ์อากาศจะมีหิมะตกในสุดสัปดาห์นี้หรือไม่?,find
สภาพอากาศในฝรั่งเศสเป็นอย่างไร,find
คืนนี้จะหนาวแค่ไหน?,find
หิมะจะตกในสัปดาห์นี้หรือไม่?,find
ฉันต้องการพกร่มหรือไม่?,find
ตอนนี้อุณหภูมิเท่าไหร่,find
สภาพอากาศของวันนี้เป็นอย่างไร?,find
ฉันคาดหวังให้ท้องฟ้าสดใสคืนนี้ได้ไหม,find
สภาพอากาศในวอชิงตันดีซีในสัปดาห์หน้าจะเป็นอย่างไร?,find
ความชื้นเป็นอย่างไรบ้าง,find
มีปัญหาหมอกที่ต้องกังวลเกี่ยวกับเช้านี้หรือไม่?,find
เราจะเจอหิมะกี่นิ้ว,find
ฉันต้องการพกร่มไหม,find
ฉันควรจะนำเสื้อกันลมของฉันไปด้วยหรือไม่?,find
วันนี้สภาพอากาศเป็นอย่างไร?,find
วันนี้จะร้อนแค่ไหน?,find
ฝนจะตกอีกครั้งไหมในบ่ายวันนี้,find
ฝนจะตกไหมวันนี้?,find
สภาพอากาศในพอร์ตแลนด์สัปดาห์นี้เป็นอย่างไรบ้าง?,find
อุณหภูมิปัจจุบันใน Martinsville?,find
จะร้อนแค่ไหนในวันพฤหัสบดีที่ Ft.lauderdale,find
ฉันควรจะต้องสวมแว่นกันแดดหรือไม่?,find
นานแค่ไหนที่ฝนตก?,find
สภาพอากาศในวันนี้มีเป็นอย่างไร?,find
อุณหภูมิปัจจุบันในสกอตแลนด์คืออะไร?,find
การคาดเดาที่ทะเลสำหรับวันพรุ่งนี้,find
ถนนปกคลุมด้วยน้ำแข็งไหม,find
พยากรณ์อากาศ 10 วัน,find
จะมีฝนตกในแอชแลนด์วันพรุ่งนี้หรือไม่?,find
สภาพอากาศในฟลอริด้าวันนี้เป็นอย่างไร,find
แคดดออกมั้ยวันอาทิตย์?,find
ฉันต้องการเสื้อกันฝนวันนี้หรือไม่?,find
คืนนี้ฝนจะตกไหม?,find
พรุ่งนี้จะมีแดดออกมั้ย,find
สภาพอากาศในวันนี้เป็นอย่างไร?,find
ฉันควรจะคลุมพืชของฉันสำหรับน้ำค้างแข็งไหม?,find
สภาพอากาศในลอนดอนคืออะไร?,find
ควรพกร่มมาด้วยหรือไม่?,find
อากาศในเขตสีส้ม,find
อากาศดูเป็นอย่างไรในวันคริสต์มาส,find
มีพายุฝนฟ้าคะนองในสัปดาห์นี้หรือไม่?,find
วันนี้จะมีแดดออกมั้ย?,find
แสดงพยากรณ์อากาศ 10 วัน,find
อากาศเป็นอย่างไรในซีแอเทิล,find
มีเมฆมากหรือมีแดดพรุ่งนี้,find
พยากรณ์อากาศสำหรับชิคาโก้วันนี้,find
ฉันควรจะนำครีมกันแดดของฉันหรือไม่?,find
อุณหภูมิในแนชวิลล์เทนเนสซี,find
หิมะมันกำลังจะตก?,find
ข้างนอกลมแรงมั้ย,find
ดัชนีความร้อนสัปดาห์นี้คืออะไร?,find
ฝนจะตกมั้ย?,find
พรุ่งนี้ในออสตินฝนจะตกไหม?,find
ฉันควรจะนำเสื้อคลุมของฉันวันนี้ไหม?,find
ฉันควรจะพกร่มตอนบ่ายนี้หรือไม่?,find
สภาพอากาศใน อามาริลโล ตอนนี้เป็นอย่างไร,find
วันนี้ฉันควรใส่เสื้อแขนยาวไหม,find
พรุ่งนี้จะมีลมแรงไหม,find
พรุ่งนี้อุณหภูมิคืออะไร,find
ดัชนีความร้อนวันนี้คืออะไร?,find
อุณหภูมิคืออะไรตอน9โมงเช้า?,find
สภาพอากาศจะมีเมฆในสัปดาห์นี้หรือไม่?,find
คืนนี้จะเย็นมั้ย?,find
อุณหภูมิเท่าไหร่,find
ฉันจะต้องพกร่มในวันเสาร์ในเดย์ตันไหม,find
ฉันต้องการเสื้อกันฝนเช้านี้มั้ย?,find
ฉันควรสวมแว่นตากันแดดในวันพรุ่งนี้หรือไม่?,find
ความชื้นวันนี้เป็นอย่างไรบ้าง?,find
วันพรุ่งนี้อุณหภูมิจะเป็นอย่างไร?,find
ลมแรงมากแค่ไหนพรุ่งนี้?,find
อากาศใน Tucson วันนี้เป็นอย่างไรบ้าง,find
วันนี้จะร้อนแค่ไหน?,find
พยากรณ์อากาศโดยเฉลี่ยสำหรับเดือนกันยายนเป็นยังไง,find
วันนี้จะมีแดดไหม,find
ร้อนแค่ไหนวันนี้?,find
ฝนตกเมื่อไหร่จะหยุด,find
สภาพอากาศในเท็กซัสเป็นอย่างไรบ้างตอนนี้,find
ตอนนี้อุณหภูมิอยู่ที่เท่าไร,find
ฉันสามารถคาดหวังฝนบางวันได้หรือไม่?,find
ฉันควรจะคาดว่าฝนจะตกมั้ยวันนี้,find
"อากาศสำหรับ Bryan, Texas วันนี้",find
จะมีหิมะตกมั้ยในสัปดาห์นี้,find
วันนี้จะร้อนแค่ไหน?,find
วันหยุดสุดสัปดาห์จะมีหิมะตกไหม,find
อุณหภูมิจะเฉลี่ยในวันนี้คืออะไร?,find
มีพายุเฮอริเคนที่มุ่งหน้าไปทางฟลอริด้าในขณะนี้หรือไม่,find
ฝนตกมากไหม?,find
พยากรณ์อากาศในช่วงสุดสัปดาห์นี้คืออะไร?,find
อากาศในฮาวายในเดือนเมษายนเป็นยังไง,find
วันนี้จะหนาวแค่ไหน,find
วันนี้ร้อนแค่ไหน,find
ปริมาณน้ำฝนเท่าไหร่ที่คาดว่าจะอยู่ใน Bantam,find
มีพยากรณ์อากาศสำหรับพายุเฮอริเคนบ้างไหม,find
มีลมแรงในเนวาดาหรือไม่?,find
ฉันจะต้องมีเสื้อแจ็คแก็ตมั้ยในแคนาดา?,find
วันนี้ฝนจะตกกี่โมงใน SF,find
อุณหภูมิจะเป็นอย่างไรเวลา 5 โมงเย็น,find
คืนนี้จะหนาวแค่ไหน,find
สภาพอากาศจะเป็นอย่างไรที่ ONTARIO ในสัปดาห์หน้า?,find
อากาศเป็นยังไงวันเสาร์ถัดไป,find
จะมีน้ำค้างแข็งในตอนเช้าหรือไม่?,find
หิมะจะตกเยอะไหมที่ Milwaukee ?,find
อากาศจะเป็นอย่างไรสุดสัปดาห์นี้,find
วันหยุดสุดสัปดาห์นี้จะมีหิมะตกไหม,find
อุณหภูมิตอนนี้คืออะไร?,find
มันเย็นมากสำหรับเสื้อคลุมไหม?,find
ควรใส่แจ็คเก็ตไหมวันนี้,find
ฉันจะต้องมีร่มมั้ยในวันพรุ่งนี้ที่ซีแอตเทิล?,find
คาดว่าจะมีหิมะตกมั้ยในวันอังคาร,find
พรุ่งนี้จะมีแดดไหม,find
ฝนจะตกมั้ยวันเสาร์นี้,find
ตอนนี้ฝนตกที่ Disney World แล้วหรือยัง,find
มีโอกาสเกิดฝนตกหรือไม่?,find
พยากรณ์อากาศว่ายังไงสำหรับวันพรุ่งนี้,find
ฝนตกในสัปดาห์หน้าหรือไม่?,find
วันนี้จะอับชื้นมั้ย,find
ฉันต้องการเสื้อคลุมไหมวันนี้,find
อีกกี่อาทิตย์จนกว่าอากาศจะเย็นลง,find
ฉันควรเปิดเสื้อผ้าฤดูหนาวออกเมื่อไร,find
พยากรณ์อากาศ 10 วันถัดไปคืออะไร?,find
คุณภาพอากาศจะเป็นอย่างไรตอน 7 โมงเช้า,find
วันเสาร์ฝนตกหรือไม่?,find
ฉันจะต้องการเสื้อกันหนาวไหมวันนี้?,find
ฉันควรสวมหมวกไหมวันนี้,find
มันจะยังคงมีหิมะตกอยู่มั้ยในสัปดาห์นี้?,find
วันนี้อุณหภูมิจะเป็นอย่างไร?,find
ฉันควรจะพกร่มไปด้วยมั้ย?,find
ฉันควรจะเอาร่มไปด้วยไหมคืนนี้?,find
ในวันนี้ฉันควรสวมเสื้อกันฝนไหม,find
คืนนี้จะมีหิมะไหม?,find
ฉันควรจะเอาร่มมาในวันนี้หรือไม่,find
จะมีพายุหิมะมาเร็ว ๆ นี้หรือไม่?,find
สภาพอากาศดูเหมือนว่าเป็นอย่างไรพรุ่งนี้,find
หิมะตกในเดนเวอร์ตอนนี้หรือไม่?,find
วันนี้มีแดดในอลาสก้าหรือไม่?,find
เย็นนี้อุณหภูมิจะเป็นอย่างไรบ้าง?,find
วันนี้ฝนจะตกหรือ?,find
จะมีหิมะตกในสัปดาห์นี้ไหม,find
คืนนี้จะหนาวแค่ไหน?,find
วันนี้หิมะตกหรือไม่?,find
มีโอกาสจะเกิดฝนตกมากไหมในวันนี้?,find
วันนี้หิมะจะตกในภาคเหนือของ dakota ไหม,find
สภาพอากาศที่ Ocean City ในสัปดาห์หน้าเป็นอย่างไร,find
วันนี้ฉันต้องการเสื้อแจ็คเก็ตไหม,find
อุณหภูมิควรจะเป็นเท่าไหร่ในวันนี้,find
อากาศของวันพรุ่งนี้ได้โปรด,find
ฉันควรนำครีมกันแดดไปบ้างไหม?,find
จะหนาวแค่ไหนตอนตี2พรุ่งนี้ที่ฟอร์ตเวิรต์,find
โปรดแสดงพยากรณ์อากาศ 7 วันให้ฉันดูหน่อย,find
อากาศที่อลาสก้าเป็นยังไง,find
สภาพอากาศในลอสแอนเจลิสวันนี้?,find
วันพรุ่งนี้ฉันต้องนำแจ็คเก็ตไปด้วยไหม?,find
พยากรณ์อากาศในวันพรุ่งนี้ที่ Los Angeles คืออะไร,find
ในวันพรุ่งนี้มีโอกาสจะเกิดพายุทอร์นาโดหรือไม่?,find
วันนี้ฉันต้องนำเสื้อกันฝนมาด้วยหรือไม่?,find
ข้อมูลสภาพอากาศปัจจุบัน,find
อุณหภูมิสำหรับวันพรุ่งนี้คืออะไร?,find
คาดว่าพรุ่งนี้มีฝนตกเท่าไหร่,find
วันนี้ร้อนแค่ไหน?,find
ฉันควรคาดว่าหิมะจะหนากี่นิ้ววันนี้,find
มันจะต่ำกว่าจุดเยือกแข่งคืนนี้มั้ย,find
ฉันต้องการเสื้อหนาวในวันนี้หรือไม่?,find
มีพายุที่มุ่งหน้าไปยังพื้นที่ของฉันหรือไม่?,find
ฝนจะตกหนักวันนี้ไหม,find
เราจะมีฝนตกกี่วันในอาทิตย์นี้?,find
วันนี้จะเกิดพายุหรือไม่?,find
นานแค่ไหนที่คาดว่าฝนจะตก?,find
วันนี้หิมะจะมีมากแค่ไหน?,find
หิมะจะเริ่มตกตอนไหน,find
อุณหภูมิในเบลมอนต์รัฐแมริแลนด์,find
หิมะจะตกมากแค่ไหนในวันนี้?,find
อุณหภูมิในวันพรุ่งนี้ในเนเปิลส์คืออะไร?,find
ฉันควรสวมเสื้อกันหนาวไหม?,find
ให้การอัปเดตสภาพอากาศแก่ฉัน,find
สภาพอากาศสำหรับสัปดาห์หน้าในวอชิงตันดีซี,find
ฉันควรเอาแจ็คเก็ตไปด้วยในการเดินทางไปไอโอวาวันจันทร์ถัดไปมั้ย,find
พายุฝุ่นในวันนี้,find
วันพรุ่งนี้ดัชนีความร้อนคืออะไร,find
วันพรุ่งนี้ฉันต้องนำร่มใปด้วยหรือไม่?,find
อุณหภูมิภายนอกคืออะไรตอนนี้?,find
เราจะเจอฝนตกมากไหมในวันนี้?,find
หิมะตกแค่ไหนที่แมสซาชูเซตส์,find
วันนี้จะร้อนมั้ย,find
อากาศเป็นยังไงสัปดาห์นี้,find
ความชื้นสำหรับวันพรุ่งนี้จะเป็นอย่างไร?,find
ฉันต้องการรองเท้าบูทหิมะของฉันมั้ยในวันนี้,find
วันนี้จะมีแดดหรือไม่?,find
พยากรณ์อากาศสำหรับวันพรุ่งนี้คืออะไร?,find
พรุ่งนี้จะมีแดดไหม?,find
วันนี้ใน Los Angeles จะร้อนมากไหม?,find
ความชื้นในปัจจุบันในไมอามีคืออะไร?,find
อากาศสุดสัปดาห์นี้จะเป็นอย่างไร?,find
อุณหภูมิปัจจุบันที่ ลองไอส์แลนด์ คืออะไร?,find
ข้างนอกเป็นอย่างไรบ้าง,find
อุณหภูมิเท่าไรในวันนี้?,find
มันมืดครึ้มมั้ย?,find
มันจะเป็นเมฆมากไหม?,find
สุดสัปดาห์นี้จะร้อนไหม?,find
อากาศในพรุ่งนี้ใน เอลเอ,find
จะมีหิมะตกในตอนเย็นหรือไม่?,find
ฝนจะตกในชิคาโกในสัปดาห์หน้าหรือไม่?,find
ฉันต้องการเสื้อแจ็คเก็ตไหม?,find
วันนี้มันหนาวแค่ไหน?,find
มีโอกาสจะเกิดฝนตกในคืนนี้กี่เปอร์เซ็นต์?,find
พรุ่งนี้แดดจะออกมั้ย,find
จะเป็นน้ำแข็งหมดมั้ยอาทิตย์หน้า,find
ความชื้นคืออะไรตอนนี้?,find
คืนนี้จะหนาวมั้ย?,find
ฝนตกกี่นิ้วในวันนี้,find
สภาพอากาศใน Chapel Hill เวลาตี 1 คืออะไร?,find
จะมีโอกาสที่เกิดพายุฟ้าผ่าคืนนี้ไหม,find
อุณหภูมิในลอนดอนตอนนี้คืออะไร?,find
วันนี้ฉันต้องมีเสื้อกันฝนไหม,find
จะมีหิมะหรือไม่?,find
วันพรุ่งนี้จะมีหิมะตกไหม,find
แดดจะออกกี่โมง,find
ตอนนี้ จาไมก้า ร้อนแค่ไหน,find
มีแดดออกในฟิลาเดลเฟีย?,find
อุณหภูมิภายนอกคืออะไรตอนนี้,find
อุณหภูมิแบบไหนที่ชิคาโกมีในฤดูหนาวนี้?,find
อะไรคือวันที่ร้อนที่สุดในสัปดาห์นี้?,find
จำเป็นต้องใช้ร่มไหม?,find
ฝนตกในสัปดาห์นี้หรือไม่?,find
วันนี้ฝนจะตกใน South Lyon หรือไม่?,find
วันนี้ร้อนแค่ไหน,find
เย็นมั้ยในวันนี้,find
