utterance,labels
จะร้อนแค่ไหนเวลาบ่าย2โมง?,find
วันนี้จะร้อนแค่ไหน?,find
ฝนจะตกมั้ยวันนี้,find
ฝนจะตกไหม?,find
วันนี้ฉันต้องการรองเท้าบูทกันฝนมั้ย?,find
สภาพอากาศในมหานครนิวยอร์กเป็นอย่างไร?,find
สภาพอากาศวันนี้คืออะไร?,find
ฝนตกวันเสาร์หรือไม่?,find
ลูกเห็บจะตกไหม,find
วันพรุ่งนี้ฝนตกที่ลาสเวกัส?,find
เวลาไหนที่พายุควรจะเริ่มต้น,find
วันนี้มันหนาวแค่ไหน,find
พรุ่งนี้จะมีแดดฟอร์ตลอเดอเดลไหม?,find
หิมะจะตกในเวอร์มอนต์ในสัปดาห์หน้า?,find
ฉันต้องการเสื้อคลุมไหม?,find
พรุ่งนี้อากาศเป็นอย่างไร,find
วันนี้หิมะตกหรือไม่?,find
เวลาไหนที่ฝนจะตกคืนนี้?,find
วันนี้มีแดดหรือไม่?,find
ฉันควรจะนำเสื้อกันฝนไปหรือไม่?,find
พรุ่งนี้สภาพอากาศในซีแอตเติลคืออะไร?,find
มีหิมะสูงกี่นิ้วในวันนี้,find
คุณบอกอุณหภูมิเฉลี่ยสำหรับวันพรุ่งนี้ได้ไหม,find
ฉันสามารถสวมรองเท้าแตะได้หรือไม่?,find
สภาพอากาศปัจจุบันใน Los Angeles,find
วันนี้ฝนจะตก,find
ฉันจะต้องใส่แจ็คเก็ตในชิคาโกในสัปดาห์นี้หรือไม่?,find
วันนี้สภาพอากาศหิมะตก,find
สภาพอากาศสำหรับวันหยุดสุดสัปดาห์ถัดไปคืออะไร?,find
ฉันต้องแพ็คเสื้อสำหรับการเดินทางของฉันวันหยุดสุดสัปดาห์นี้,find
ฉันจะต้องสวมเสื้อคืนนี้ไหม?,find
มีพายุมาไหม,find
จะมีฝนตกในเวลา 14.00 น. วันนี้,find
มีพายุทอร์นาโดอยู่ไหม,find
สภาพอากาศในไมอามี่วันนี้เป็นอย่างไร,find
สิ่งที่ความชื้นในฟลอริดาวันนี้?,find
สภาพอากาศใน Wildwood คืออะไรวันนี้?,find
ฉันต้องการร่มหรือไม่?,find
พยากรณ์อากาศสำหรับ Akron Ohio,find
มีพายุฝนฟ้าคะนองในวันนี้หรือไม่?,find
พยากรณ์อากาศในสัปดาห์หน้าคืออะไร,find
ยกเลิกนาฬิกาปลุกทั้งหมดสำหรับพรุ่งนี้,cancel_alarm
นาฬิกาปลุกตอนเช้าตั้งปลุกกี่โมง,show_alarms
ตั้งปลุกทุกวันศุกร์เวลา 10:00 น,set_alarm
ปิดเสียงเตือนชั่วคราวไว้ 10 นาที,snooze_alarm
บอกฉันนาฬิกาปลุกกี่โมง,show_alarms
ตั้งปลุก 5 โมงเย็นวันเสาร์,set_alarm
ยกเลิกนาฬิกาปลุกของฉัน,cancel_alarm
ตั้งปลุกทุกนาทีเป็นเวลา 2 ชั่วโมง,set_alarm
ตั้งปลุกวันอังคาร 6 โมงเช้า,set_alarm
ตั้งปลุกเวลา ตี1 วันอังคาร,set_alarm
ตั้งนาฬิกาปลุก,set_alarm
ตั้งเวลาปลุกที่ 4.30 น. ในวันจันทร์,set_alarm
กรุณาตั้งเวลาปลุก 9:30 น.,set_alarm
ตั้งเตือนวันพรุ่งนี้,set_alarm
ตั้งปลุกวันศุกร์เวลา 7โมงเช้า,set_alarm
ตั้งเวลาปลุกที่ 13.00 น.,set_alarm
ตั้งปลุกวันพรุ่งนี้ ตี5.15,set_alarm
ยกเลิกนาฬิกาปลุกวันเสาร์,cancel_alarm
ตั้งเวลาปลุก 7:00 น. ด้วยการเลื่อนการเตือนล่วงหน้า 5 นาที,set_alarm
ลบนาฬิกาปลุกทั้งหมดสำหรับสุดสัปดาห์,cancel_alarm
ดูนาฬิกาปลุกของฉัน,show_alarms
มีสัญญาณเตือนอะไรบ้างในอาทิตย์นิ้,show_alarms
ตั้งเวลาปลุก 4 ทุ่ม,set_alarm
ตั้งปลุกทุกๆสองชั่วโมงในขณะที่ฉันทำโปรเจ็คของโรงเรียนของฉัน,set_alarm
ตั้งเวลาปลุก 1 ทุ่มคืนนี้,set_alarm
ปิดเวลาปลุก,cancel_alarm
ตั้งเวลาปลุกเป็นเวลา 8 โมงเช้า,set_alarm
ตั้งเวลาปลุก 6 โมงเช้า,set_alarm
ตั้งปลุกเป็นเวลา 1 นาฬิกาในภายหลัง,set_alarm
ยกเลิกการปลุกสำหรับคืนนี้,cancel_alarm
ยกเลิกเวลาปลุก,cancel_alarm
ตั้งเวลปลุกสำหรับปลุกให้ตื่น,set_alarm
ปิดการตั้งเวลาปลุก,cancel_alarm
ตั้งปลุกวันเสาร์เวลา 10 โมงเช้า,set_alarm
ตั้งเวลาปลุก 2 ชั่วโมงตอนนี้,set_alarm
ตั้งปลุก 5 โมงเย็น,set_alarm
ยกเลิกเวลาปลุกตอนเช้า,cancel_alarm
ตั้งเวลาปลุก 7:20 น.สำหรับรองเท้าออกใหม่,set_alarm
นาฬิกาปลุกปิดอยู่,cancel_alarm
คุณช่วยตั้งเวลาปลุกได้ไหม 5:30 น,set_alarm
แสดงการเตือนทั้งหมดในสัปดาห์นี้,show_alarms
ตั้งเวลาปลุก,cancel_alarm
ยกเลิกการตั้งเวลาปลุกทั้งหมด,cancel_alarm
คุณตั้งเวลาปลุกให้ฉันหน่อยตอนบ่าย 5 โมง,set_alarm
ตั้งปลุกทุก 90 วินาทีเป็นเวลา 30 นาที,set_alarm
แสดงการเตือนที่ตั้งขึ้นในวันพรุ่งนี้,show_alarms
ตั้งเวลาปลุกทุกๆ 10 นาที,set_alarm
ตั้งปลุกเป็นเวลา 6 โมงทุกวัน,set_alarm
ตั้งเวลาปลุกเวลาอาบน้ำ,set_alarm
ปิดการเตือนทั้งหมดในวันนี้,cancel_alarm
เลื่อนปลุกเออกไปตอนเวลา 6 โมงเช้า,cancel_alarm
ตั้งเวลาปลุกบอกฉันว่าจะเริ่มโครงการเมื่อไหร่,set_alarm
ยกเลิกเวลาปลุกของฉันคืนนี้,cancel_alarm
พรุ่งนี้เช้าตั้งเวลาปลุกไว้กี่โมง,show_alarms
วันพรุ่งนี้ฉันจะตั้งเวลาปลุกอะไร,show_alarms
ตั้งเวลาปลุก15 นาทีทุกๆ 1 นาที,set_alarm
เหลือเวลาอีกเท่าไหร่ก่อนที่เวลาจะหมด?,time_left_on_alarm
ลบการเตือนทั้งหมด,cancel_alarm
ตั้งเวลาปลุกอะไรอาทิตย์หน้า,show_alarms
เวลาปลุกทุกๆ 4 นาที,set_alarm
ฉันเหลือเวลาเท่าไหร่กว่าเวลาจะปลุก,time_left_on_alarm
ยกเลิกการปลุก,cancel_alarm
ตั้งเวลาปลุกพรุ่งนี้,set_alarm
ตั้งเวลาปลุก,set_alarm
ตั้งเวลาปลุกบ่ายโมง,set_alarm
ดูเวลาการแจ้งเตือนทั้งหมด,show_alarms
ปิดการปลุกเตือนทั้งหมดในเดือนถัดไป,cancel_alarm
ปิดการตั้งเวลาปลุกทั้งหมด,cancel_alarm
แสดงนาฬิกาปลุกของฉัน,show_alarms
ยกเลิกตั้งเวลาปลุกทั้งหมด,cancel_alarm
นาฬิกาปลุกตั้งไว้สำหรับเวลา 5 โมงเช้า,set_alarm
ยกเลิกการแจ้งเตือนวันอังคาร,cancel_alarm
ยกเลิกการแจ้งเตือนรายสัปดาห์,cancel_alarm
แสดงการเตือนทั้งหมดของฉัน,show_alarms
แสดงนาฬิกาปลุกของฉัน,show_alarms
วันพรุ่งนี้เช้าฉันจะตั้งเวลาปลุกอะไร,show_alarms
ยกเลิกการตั้งเวลาปลุกตอนเช้า,cancel_alarm
ตั้งปลุกไปหาหมอฟัน,set_alarm
ไม่ต้องตั้งเวลาปลุกให้ฉันศุกร์นี้,cancel_alarm
ตั้งปลุกเป็นเวลา 5 โมงเช้าหรือไม่?,show_alarms
กรุณายกเลิกตั้งเวลาปลุกทั้งหมด,cancel_alarm
ตั้งเวลาปลุกด้วย 10 นาทีทุกๆ 1 นาที,set_alarm
ตั้งเวลาปลุก 20.00 น,set_alarm
ตั้งปลุกออกกำลังกายเวลา 5:30 น,set_alarm
ตั้งเวลาปลุก 2 ทุ่มคืนนี้,set_alarm
ยกเลิกตั้งเวลาปลุกทั้งหมด,cancel_alarm
แสดงนาฬิกาปลุกของฉันวันนี้,show_alarms
ยกเลิกการปลุก,cancel_alarm
ตั้งเวลาปลุก 10 นาที,set_alarm
ปิดการตั้งเวลาปลุก,cancel_alarm
ฉันได้ตั้งเวลาปลุก 8 โมงเช้ามั๊ย?,show_alarms
ดูเวลาปลุก,set_alarm
ตั้งเวลาปลุกตอนเช้า 6 โมงครึ่ง,set_alarm
ตั้งเวลาปลุกบ่าย 3 โมง,set_alarm
ฉันต้องการตั้งเวลาปลุก 18:30 น.,set_alarm
ตั้งเวลาปลุกวันจันทร์ 7 โมงเช้า,set_alarm
โปรดตั้งค่าเวลาปลุกทั้งหมดที่ฉันได้ตั้งไว้,show_alarms
ตั้งเวลาปลุกเป็นเวลา 6 โมงเช้า,set_alarm
ยกเลิกตั้งเวลาปลุกทั้งหมด,cancel_alarm
ตั้งเวลาปลุก 6 โมงเช้า,set_alarm
ยกเลิกนาฬิกาปลุก,cancel_alarm
ปิดนาฬิกาปลุก,cancel_alarm
ยกเลิกการเตือนในวันนี้,cancel_alarm
ยกเลิกตั้งเวลาปลุกทั้งหมด,cancel_alarm
ตั้งเวลาปลุก 8:30 น,set_alarm
ต้องการเห็นเวลาปลุกตอนเช้า,show_alarms
ตั้งเวลาปลุกในวันอาทิตย์เวลา 12.00 น,set_alarm
เวลาปลุกของฉันคืออะไร,show_alarms
ตั้งปลุกให้ปลุกฉันตอน 8 โมง,set_alarm
ตั้งเวลาปลุกวันจันทร์ 10 โมงเช้า,set_alarm
ปิดการตั้งเวลาปลุกทั้งหมด,cancel_alarm
ยกเลิกตั้งเวลาปลุกตี 5,cancel_alarm
ปลุก 7โมง,set_alarm
ตั้งเวลาปลุก 1 ทุ่มวันศุกร์,set_alarm
ยกเลิกตั้งเวลาปลุก 10 ชั่วโมงตอนนี้,set_alarm
ตั้งปลุก 6 โมงเช้าพรุ่งนี้,set_alarm
ปิดตั้งเวลาปลุกด่วน,cancel_alarm
ตั้งปลุกเป็นเวลา 5:30 น,set_alarm
ตั้งเวลาปลุกตอนเช้า 6 โมงทุกวัน,set_alarm
กี่ชั่วโมงจนกว่าการปลุกของฉันจะดับลงในตอนเช้า,time_left_on_alarm
ยกเลิกตั้งเวลาปลุก,cancel_alarm
ลบการเตือนปลุกทั้งหมดของวันนี้,cancel_alarm
ตั้งเวลาปลุก 8 โมงเช้าส่งข้อความหาคริส,set_alarm
ปิดเสียงเตือนชั่วคราวไว้ 10 นาทีแล้วเปิดใหม่อีกครั้ง,snooze_alarm
ตั้งเวลาปลุก 7.00 น. คืนนี้,set_alarm
ตั้งปลุก 5 โมงเย็นนี้,set_alarm
ตั้งเวลาปลุกตอนเช้า 6 โมง,set_alarm
เวลาปลุกฉันตั้งไว้บ่ายวันจันทร์มั๊ย?,show_alarms
ตั้งเวลาปลุกตี 5 วันเสาร์,set_alarm
ตั้งเวลาปลุก 9.00 น. พรุ่งนี้ตอนกลางคืน,set_alarm
ลบการเตือนของฉันในวันนี้,cancel_alarm
ตั้งเวลาปลุกวันเสาร์เช้า 7 โมงสิบห้า,set_alarm
ตั้งเวลาปลุกตอนเช้า 6 โมงครึ่ง,set_alarm
เอาเวลาปลุกทั้งหมดจากวันนี้ให้ดูหน่อย,show_alarms
ยกเลิกเวลาปลุกทั้งหมด,cancel_alarm
ตั้งเวลาปลุกไว้ 5 นาทีตอนนี้,set_alarm
เลื่อนเวลาปลุกฉัน,snooze_alarm
ตั้งปลุกเวลาทำการบ้าน,set_alarm
ตั้งเวลาปลุกตอนเช้ามืดตี 4,set_alarm
ตั้งเวลาปลุกตี 5,set_alarm
ส่งรายการของสัญญาณเตือนนาฬิกาปลุกที่ฉันได้ตั้งค่า,show_alarms
ยกเลิกเวลาปลุก 6 โมงเช้า,cancel_alarm
ตั้งเวลาปลุกสำหรับอาหารเช้า,set_alarm
ตั้งเวลาปลุก 7 โมงเช้าวันอาทิตย์,set_alarm
ตั้งเวลาปลุกมีนัดไปหาหมอตอนเช้า 11 โมง,set_alarm
ปิดเสียงปลุกนี้ซ้ำ,snooze_alarm
เลื่อนเวลาปลุกฉัน,snooze_alarm
ตั้งปลุกเวลาสองทุ่ม  Two and a Half Men.,set_alarm
ตั้งเวลาปลุกไว้ 3 ชั่วโมง,set_alarm
ยกเลิกเวลาปลุก,cancel_alarm
เอาเวลาปลุกทั้งหมดที่เปิดมาให้ฉันดูหน่อย,show_alarms
เปิดตั้งปลุกทั้งหมด,set_alarm
ยกเลิกการปลุกทั้งหมดสำหรับคืนนี้,cancel_alarm
เลื่อนเวลาปลุก 2 นาที,snooze_alarm
ปิดเสียงเตือนชั่วคราวไว้ 15 นาที,snooze_alarm
ยกเลิกเวลาปลุกทั้งหมดวันที่ 2 เดือนมีนาคม,cancel_alarm
ตั้งปลุกใหม่สำหรับวันเสาร์เวลา 9.00 น,set_alarm
ตั้งเวลาปลุก ตี 2.30,set_alarm
กรุณาตั้งเวลาปลุกตอนบ่าย 3.15 จันทร์ถึงศุกร์,set_alarm
ตั้งปลุกใหม่,set_alarm
ปลุกฉันอีก 30 นาที,set_alarm
ลบเวลาปลุกวันนี้,cancel_alarm
ตั้งปลุกเพื่อรับจดหมาย,set_alarm
ลบการปลุก 3 โมงเย็น,cancel_alarm
ลบเวลาปลุกเย็นนี้,cancel_alarm
ปิดเสียงปลุก,snooze_alarm
ยกเลิกเวลาปลุกพรุ่งนี้เช้า,cancel_alarm
ตั้งปลุกทุกนาทีเป็นเวลา 10 นาที,set_alarm
ตั้งเวลาปลุกนี้ 4 นาที,set_alarm
เวลาปลุกเหลือเท่าไหร่?,time_left_on_alarm
ความขื้นเป็นเท่าไหร่,find
คุณสามารถปิดเสียนาฬิกาปลุกของฉันได้ในสุดสัปดาห์นี้ได้ไหม,snooze_alarm
ตั้งเวลาปลุก 5 ชั่วโมงตอนนี้,set_alarm
คุณสามารถตั้งเวลาปลุกเป็นเวลา 6 โมงเช้า ได้มั้ย,set_alarm
ลบการตั้งเวลาปลุกทั้งหมด,cancel_alarm
ตั้งเวลาปลุกตอนเช้า 10.30 พรุ่งนี้,set_alarm
ยกเลิกการตั้งเวลาปลุก 6 โมงเช้า,cancel_alarm
ยกเลิกนาฬิกาปลุกทั้งหมดของฉันสำหรับสัปดาห์นี้,cancel_alarm
เวลาปลุกของฉันทำงานตอนไหนพรุ่งนี้?,show_alarms
ตั้งปลุก 5 โมงเช้าพรุ่งนี้,set_alarm
ตั้งเวลาปลุก 1 ทุ่ม,set_alarm
ตั้งเวลาปลุก 5 โมงเย็น,set_alarm
ยกเลิกตั้งเวลาปลุก 4 ทุ่ม,cancel_alarm
ตั้งเวลาปลุกใหม่ 2 ทุ่มสำหรับอาหารเย็น,set_alarm
ตั้งนาฬิกาปลุก 5:30 พาหมาเดินเล่น,set_alarm
แสดงนาฬิกาปลุกทั้งหมด,show_alarms
เวลาเหลือเท่าไหร่บนนาฬิกาปลุก,time_left_on_alarm
ปิดนาฬิกาปลุก,cancel_alarm
ตั้งปลุกเป็นเวลา 10 นาที,set_alarm
อย่าลืมตั้งนาฬิกาปลุก,set_alarm
โชว์นาฬิกาปลุกจับเวลาทำงาน,show_alarms
ตั้งเวลาปลุก 3 โมงเย็น,set_alarm
แสดงนาฬิกาปลุกันปัจจุบันของฉัน,show_alarms
ตั้งปลุกเวลา 3 โมงเย็น วันศุกร์,set_alarm
ยกเลิกนาฬิกาปลุกทั้งหมด,cancel_alarm
เลื่อนเวลาปลุก,snooze_alarm
สร้างการแจ้งเตือนใหม่เวลา 8.00 น,set_alarm
คุณสามารถตั้งเวลาปลุกสำหรับฉันวันพุตอน 6 โมง?,set_alarm
ตั้งเวลาปลุก 5:00 น.,set_alarm
ตั้งเวลาปลุก 5 โมงเย็น,set_alarm
ได้โปรดยกเลิกการปลุก 9โมงเช้า,cancel_alarm
เปลี่ยนนาฬิกาปลุก,cancel_alarm
สภาพอากาศที่เวทเทอร์แรนพาร์คเวลาสิบแปดนาฬิกาสามสิบนาทีเป็นอย่างไร,find
อุณหภูมิของวันอาทิตย์เป็นอย่างไร,find
สัปดาห์หน้าพยากรณ์อากาศในการเดินทางของฉันในมหานครนิวยอร์กเป็นอย่างไร,find
คาดว่าพายุเฮอริเคนจะเข้าสู่อเมริกาเร็ว ๆ นี้,find
"เข่าของฉันเจ็บ, เราคาดว่าฝนอาจจะตก",find
สภาพอากาศในสเปนเป็นอย่างไร,find
สัปดาห์หน้าสภาพอากาศจะเป็นอย่างไร,find
วันนี้จะมีแสงแดดส่องลงชายฝั่งทะเลไหม,find
ฉันสามารถคาดหวังว่าสัปดาห์นี้หิมะอาจจะตกเมื่อไหร่ได้บ้าง,find
บอกฉันหน่อยว่าสภาพอากาศวันนี้เป็นอย่างไร,find
วันนี้ฉันต้องสวมหมวกกันแดดไหม,find
สภาพอากาศในฟอร์ตคอลลินส์เป็นอย่างไร,find
วันนี้จะร้อนแค่ไหน,find
ฉันจำเป็นต้องมีร่มไหม,find
สุดสัปดาห์นี้สภาพอากาศจะเป็นอย่างไร,find
จงแสดงผลพยากรณ์อากาศภายในห้าวันให้ฉันหน่อย,find
สุดสัปดาห์นี้เปอร์เซ็นต์ของฝนจะเป็นอย่างไร,find
วันนี้จะมีแสงแดดไหม,find
วันนี้อุณหภูมิจะเป็นอย่างไร,find
จะมีฝนตกที่มอนทรีออลแคนาดาในครั้งต่อไปเมื่อไหร่,find
วันพรุ่งนี้จะมีลูกเห็บตกไหม,find
มันจะหนาวแค่ไหน,find
วันนี้จะมีลูกเห็บตกเวลากี่โมง,find
พยากรณ์อากาศในสิบวันนี้จะเป็นอย่างไร,find
หิมะจะตกเร็วๆ นี้ไหม,find
พรุ่งนี้น้ำจะท่วมไหม,find
อุณภูมิคืนนี้จะเป็นเท่าไหร่,find
คืนนี้อุณภูมิจะเป็นเท่าไหร่,find
พรุ่งนี้อากาศน่าจะเป็นอย่างไร,find
พยากรณ์อากาศที่เบลิเออร์ โอไฮโอเป็นอย่างไร,find
วันนี้ฝนจะตกนานแค่ไหน,find
พยากรณ์อากาศของสัปดาห์หน้าจะเป็นอย่างไร,find
อากาศเป็นอย่างไรวันนี้,find
ข่าวอากาศวันนี้มีอะไรบ้าง,find
อากาศวันเสาร์เป็นอย่างไร,find
อุณหภูมิวันอังคารจะเป็นเท่าไหร่,find
ข้างนอกหนาวไหม,find
คืนนี้ฉันต้องใช้ร่มไหม,find
ฉันควรนำเสื้อคลุมไปไหมคืนนี้,find
มันจะร้อนไหมวันนี้,find
ฉันต้องใช้ร่มไหมวันนี้,find
คืนนี้อากาศจะหนาวไหม,find
แดดจะออกทั้งวันไหมวันนี้,find
สัปดาห์นี้ฝนจะตกกี่วัน,find
บริเวณนี้มีพายุทอร์นาโดไหม,find
